{
  "configuration_sha256": "4444444444444444444444444444444444444444444444444444444444444444",
  "contract_set_sha256": "1111111111111111111111111111111111111111111111111111111111111111",
  "engine_artifact_sha256": "3333333333333333333333333333333333333333333333333333333333333333",
  "engine_name": "openbrec-core-replay",
  "engine_version": "1.0.0",
  "errors": [
    "invalid input aborted outputs"
  ],
  "generated_at": "2026-07-17T12:28:00.000000Z",
  "input_events_sha256": "8888888888888888888888888888888888888888888888888888888888888888",
  "outputs_sha256": "e3b0c44298fc1c149afbf4c8996fb92427ae41e4649b934ca495991b7852b855",
  "receipt_id": "dddddddd-dddd-4ddd-8ddd-ddddddddddde",
  "result": "failed",
  "result_sha256": "9999999999999999999999999999999999999999999999999999999999999999",
  "schema_version": "1.0.0",
  "upstream_receipt_sha256": "2222222222222222222222222222222222222222222222222222222222222222"
}
