{
  "configuration_sha256": "4444444444444444444444444444444444444444444444444444444444444444",
  "contract_set_sha256": "1111111111111111111111111111111111111111111111111111111111111111",
  "engine_artifact_sha256": "3333333333333333333333333333333333333333333333333333333333333333",
  "engine_name": "openbrec-core-replay",
  "engine_version": "1.0.0",
  "errors": [],
  "generated_at": "2026-07-17T12:27:00.000000Z",
  "input_events_sha256": "5555555555555555555555555555555555555555555555555555555555555555",
  "outputs_sha256": "6666666666666666666666666666666666666666666666666666666666666666",
  "receipt_id": "dddddddd-dddd-4ddd-8ddd-dddddddddddd",
  "result": "passed",
  "result_sha256": "7777777777777777777777777777777777777777777777777777777777777777",
  "schema_version": "1.0.0",
  "upstream_receipt_sha256": "2222222222222222222222222222222222222222222222222222222222222222"
}
